{
  "$schema": "./tokens.schema.json",
  "name": "Urban AI Design Tokens",
  "version": 1,
  "description": "Fonte unica dos tokens primitivos, semanticos e aliases CSS do produto.",
  "primitives": {
    "color": {
      "light": {
        "canvas": "#FAFAFB",
        "surface": "#FFFFFF",
        "surface-muted": "#F4F5F7",
        "admin-canvas": "#F7F7F8",
        "ink": "#0E1116",
        "admin-ink": "#10141A",
        "brand": "#9B3104",
        "brand-hover": "#7F2600",
        "success": "#137A55",
        "admin-success": "#137A55",
        "warning": "#C8810E",
        "admin-warning": "#9A6508",
        "danger": "#C2342E",
        "admin-danger": "#B42318"
      },
      "dark": {
        "canvas": "#080A0F",
        "surface": "#11151C",
        "surface-elevated": "#171C24",
        "surface-muted": "#151A22",
        "navigation": "#0E1117",
        "white": "#FFFFFF",
        "brand": "#E8500A",
        "brand-hover": "#FF6A1A",
        "success": "#4ADE80",
        "warning": "#F5B547",
        "danger": "#F87171",
        "oled": "#000000"
      },
      "alpha": {
        "light-ink-04": "rgba(14, 17, 22, 0.04)",
        "light-ink-06": "rgba(14, 17, 22, 0.06)",
        "light-ink-08": "rgba(14, 17, 22, 0.08)",
        "light-ink-12": "rgba(14, 17, 22, 0.12)",
        "light-ink-16": "rgba(14, 17, 22, 0.16)",
        "light-ink-42": "rgba(14, 17, 22, 0.42)",
        "light-ink-45": "rgba(14, 17, 22, 0.45)",
        "light-ink-62": "rgba(14, 17, 22, 0.62)",
        "light-ink-66": "rgba(14, 17, 22, 0.66)",
        "light-ink-70": "rgba(14, 17, 22, 0.70)",
        "admin-ink-08": "rgba(16, 20, 26, 0.08)",
        "admin-ink-12": "rgba(16, 20, 26, 0.12)",
        "admin-ink-14": "rgba(16, 20, 26, 0.14)",
        "admin-ink-38": "rgba(16, 20, 26, 0.38)",
        "admin-ink-42": "rgba(16, 20, 26, 0.42)",
        "admin-ink-58": "rgba(16,20,26,0.58)",
        "admin-ink-62": "rgba(16, 20, 26, 0.62)",
        "brand-light-10": "rgba(155, 49, 4, 0.10)",
        "brand-light-12": "rgba(155, 49, 4, 0.12)",
        "brand-light-22": "rgba(155, 49, 4, 0.22)",
        "brand-light-25": "rgba(155, 49, 4, 0.25)",
        "success-light-10": "rgba(19, 122, 85, 0.10)",
        "success-light-25": "rgba(19, 122, 85, 0.25)",
        "warning-light-10": "rgba(200, 129, 14, 0.10)",
        "warning-light-25": "rgba(200, 129, 14, 0.25)",
        "danger-light-10": "rgba(194, 52, 46, 0.10)",
        "danger-light-25": "rgba(194, 52, 46, 0.25)",
        "white-02": "rgba(255, 255, 255, 0.02)",
        "white-04": "rgba(255, 255, 255, 0.04)",
        "white-08": "rgba(255, 255, 255, 0.08)",
        "white-12": "rgba(255, 255, 255, 0.12)",
        "white-14": "rgba(255, 255, 255, 0.14)",
        "white-18": "rgba(255, 255, 255, 0.18)",
        "white-35": "rgba(255, 255, 255, 0.35)",
        "white-42": "rgba(255, 255, 255, 0.42)",
        "white-46": "rgba(255, 255, 255, 0.46)",
        "white-55": "rgba(255, 255, 255, 0.55)",
        "white-62": "rgba(255, 255, 255, 0.62)",
        "white-65": "rgba(255, 255, 255, 0.65)",
        "white-66": "rgba(255, 255, 255, 0.66)",
        "white-92": "rgba(255, 255, 255, 0.92)",
        "brand-dark-13": "rgba(232, 80, 10, 0.13)",
        "brand-dark-15": "rgba(232, 80, 10, 0.15)",
        "brand-dark-16": "rgba(232, 80, 10, 0.16)",
        "brand-dark-30": "rgba(232, 80, 10, 0.30)",
        "brand-dark-34": "rgba(232, 80, 10, 0.34)",
        "success-dark-14": "rgba(74, 222, 128, 0.14)",
        "success-dark-28": "rgba(74, 222, 128, 0.28)",
        "warning-dark-14": "rgba(245, 181, 71, 0.14)",
        "warning-dark-28": "rgba(245, 181, 71, 0.28)",
        "danger-dark-14": "rgba(248, 113, 113, 0.14)",
        "danger-dark-30": "rgba(248, 113, 113, 0.30)",
        "black-28": "rgba(0, 0, 0, 0.28)",
        "black-30": "rgba(0, 0, 0, 0.30)",
        "black-48": "rgba(0, 0, 0, 0.48)",
        "black-62": "rgba(0, 0, 0, 0.62)",
        "black-70": "rgba(0, 0, 0, 0.70)",
        "canvas-light-82": "rgba(250, 250, 251, 0.82)",
        "canvas-dark-88": "rgba(14, 16, 21, 0.88)",
        "white-72": "rgba(255, 255, 255, 0.72)",
        "light-ink-74": "rgba(14, 17, 22, 0.74)",
        "deep-04": "rgba(16, 49, 52, 0.04)",
        "deep-05": "rgba(16, 49, 52, 0.05)",
        "deep-08": "rgba(16, 49, 52, 0.08)",
        "deep-10": "rgba(16, 49, 52, 0.10)",
        "deep-14": "rgba(16, 49, 52, 0.14)",
        "deep-22": "rgba(16, 49, 52, 0.22)",
        "deep-45": "rgba(16, 49, 52, 0.45)",
        "deep-70": "rgba(16, 49, 52, 0.70)",
        "deep-74": "rgba(16, 49, 52, 0.74)",
        "teal-12": "rgba(42, 146, 138, 0.12)",
        "teal-28": "rgba(42, 146, 138, 0.28)",
        "teal-40": "rgba(42, 146, 138, 0.40)",
        "mint-12": "rgba(199, 226, 206, 0.12)",
        "mint-14": "rgba(199, 226, 206, 0.14)",
        "mint-32": "rgba(199, 226, 206, 0.32)",
        "mint-wash-84": "rgba(244, 248, 245, 0.84)",
        "night-88": "rgba(7, 19, 20, 0.88)",
        "mint-wash-82": "rgba(244, 248, 245, 0.82)",
        "black-58": "rgba(0, 0, 0, 0.58)"
      },
      "brand": {
        "deep": "#103134",
        "teal": "#2A928A",
        "mint": "#C7E2CE",
        "lime": "#E2E798",
        "black": "#000000",
        "white": "#FFFFFF",
        "deep-hover": "#0A2123",
        "mint-wash": "#F4F8F5",
        "mint-50": "#EAF3ED",
        "night-surface": "#0C1B1D",
        "night-elevated": "#12282A",
        "night-muted": "#0F2224",
        "night-nav": "#071314"
      }
    },
    "shadow": {
      "light-card": "0 1px 2px rgba(14, 17, 22, 0.04)",
      "light-elevated": "0 4px 16px rgba(14, 17, 22, 0.06)",
      "light-overlay": "0 18px 48px rgba(14, 17, 22, 0.12)",
      "dark-card": "0 1px 2px rgba(0, 0, 0, 0.28)",
      "dark-elevated": "0 16px 48px rgba(0, 0, 0, 0.30)",
      "dark-overlay": "0 22px 72px rgba(0, 0, 0, 0.48)",
      "light-glass": "0 1px 0 rgba(14, 17, 22, 0.04), 0 10px 30px rgba(14, 17, 22, 0.08)",
      "dark-glass": "0 1px 0 rgba(255, 255, 255, 0.04), 0 10px 30px rgba(0, 0, 0, 0.55)",
      "light-sheet": "0 -12px 40px rgba(14, 17, 22, 0.14)",
      "dark-sheet": "0 -12px 48px rgba(0, 0, 0, 0.62)",
      "brand-light-card": "0 1px 2px rgba(16, 49, 52, 0.05)",
      "brand-light-elevated": "0 6px 20px rgba(16, 49, 52, 0.08)",
      "brand-light-overlay": "0 18px 48px rgba(16, 49, 52, 0.16)",
      "brand-light-glass": "0 1px 0 rgba(16, 49, 52, 0.04), 0 10px 30px rgba(16, 49, 52, 0.10)",
      "brand-light-sheet": "0 -12px 40px rgba(16, 49, 52, 0.16)"
    },
    "radius": {
      "card": "12px",
      "control": "10px",
      "pill": "999px",
      "sm": "8px",
      "lg": "16px",
      "sheet": "20px"
    },
    "breakpoint": {
      "mobile-max": "767px",
      "tablet-max": "1180px",
      "desktop-min": "1181px"
    },
    "asset": {
      "select-chevron-light": "url(\"data:image/svg+xml;utf8,<svg xmlns='http://www.w3.org/2000/svg' width='12' height='12' viewBox='0 0 24 24' fill='none' stroke='rgba(14,17,22,0.58)' stroke-width='2' stroke-linecap='round' stroke-linejoin='round'><polyline points='6 9 12 15 18 9'/></svg>\")",
      "admin-select-chevron-light": "url(\"data:image/svg+xml;utf8,<svg xmlns='http://www.w3.org/2000/svg' width='12' height='12' viewBox='0 0 24 24' fill='none' stroke='rgba(16,20,26,0.58)' stroke-width='2' stroke-linecap='round' stroke-linejoin='round'><polyline points='6 9 12 15 18 9'/></svg>\")",
      "select-chevron-dark": "url(\"data:image/svg+xml;utf8,<svg xmlns='http://www.w3.org/2000/svg' width='12' height='12' viewBox='0 0 24 24' fill='none' stroke='rgba(255,255,255,0.66)' stroke-width='2' stroke-linecap='round' stroke-linejoin='round'><polyline points='6 9 12 15 18 9'/></svg>\")",
      "admin-select-chevron-dark": "url(\"data:image/svg+xml;utf8,<svg xmlns='http://www.w3.org/2000/svg' width='12' height='12' viewBox='0 0 24 24' fill='none' stroke='rgba(255,255,255,0.62)' stroke-width='2' stroke-linecap='round' stroke-linejoin='round'><polyline points='6 9 12 15 18 9'/></svg>\")"
    },
    "blur": {
      "bar": "saturate(180%) blur(20px)",
      "sheet": "saturate(140%) blur(12px)"
    },
    "motion": {
      "duration-fast": "150ms",
      "duration-base": "200ms",
      "duration-slow": "250ms",
      "ease-standard": "cubic-bezier(0.2, 0, 0, 1)",
      "ease-emphasized": "cubic-bezier(0.16, 1, 0.3, 1)",
      "ease-exit": "cubic-bezier(0.4, 0, 1, 1)"
    },
    "type": {
      "caption": "0.75rem",
      "footnote": "0.8125rem",
      "body": "clamp(0.9375rem, 0.9rem + 0.2vw, 1rem)",
      "headline": "clamp(1rem, 0.95rem + 0.25vw, 1.0625rem)",
      "title-3": "clamp(1.125rem, 1.05rem + 0.4vw, 1.25rem)",
      "title-2": "clamp(1.375rem, 1.2rem + 0.8vw, 1.625rem)",
      "title-1": "clamp(1.75rem, 1.5rem + 1.2vw, 2.25rem)",
      "large-title": "clamp(2rem, 1.6rem + 1.8vw, 2.75rem)"
    },
    "size": {
      "touch-target": "44px",
      "tabbar-height": "58px",
      "topbar-height": "52px"
    }
  },
  "semantic": {
    "light": {
      "page": {
        "bg": "{color.brand.mint-wash}",
        "text": "{color.brand.deep}"
      },
      "public": {
        "accent": "{color.brand.deep}",
        "accent-contrast": "{color.brand.white}",
        "bg": "{color.brand.mint-wash}",
        "muted": "{color.alpha.deep-74}",
        "shadow-overlay": "{shadow.light-overlay}",
        "soft": "{color.alpha.deep-08}",
        "strong": "{color.alpha.deep-14}",
        "success": "{color.light.success}",
        "success-soft": "{color.alpha.success-light-10}",
        "surface": "{color.light.surface}",
        "text": "{color.brand.deep}"
      },
      "app": {
        "accent": "{color.brand.deep}",
        "accent-border": "{color.alpha.teal-40}",
        "accent-contrast": "{color.brand.white}",
        "accent-hover": "{color.brand.deep-hover}",
        "accent-shadow": "{color.alpha.deep-22}",
        "accent-soft": "{color.alpha.teal-12}",
        "backdrop": "{color.alpha.deep-45}",